{"schema":"perfgate.run.v1","tool":{"name":"perfgate","version":"0.18.1"},"run":{"id":"baseline","started_at":"1970-01-01T00:00:00Z","ended_at":"1970-01-01T00:00:00Z","host":{"os":"linux","arch":"x86_64","cpu_count":2,"memory_bytes":0}},"bench":{"name":"cli/compare-small","command":["./target/release/perfgate-selfbench","ci-compare-small"],"repeat":15,"warmup":2},"samples":[{"wall_ms":5,"exit_code":0,"warmup":true,"timed_out":false,"cpu_ms":3,"page_faults":0,"ctx_switches":7,"max_rss_kb":10740,"binary_bytes":680128},{"wall_ms":4,"exit_code":0,"warmup":true,"timed_out":false,"cpu_ms":3,"page_faults":0,"ctx_switches":7,"max_rss_kb":10740,"binary_bytes":680128},{"wall_ms":4,"exit_code":0,"warmup":false,"timed_out":false,"cpu_ms":2,"page_faults":0,"ctx_switches":7,"max_rss_kb":10740,"binary_bytes":680128},{"wall_ms":3,"exit_code":0,"warmup":false,"timed_out":false,"cpu_ms":2,"page_faults":0,"ctx_switches":7,"max_rss_kb":10740,"binary_bytes":680128},{"wall_ms":3,"exit_code":0,"warmup":false,"timed_out":false,"cpu_ms":3,"page_faults":0,"ctx_switches":7,"max_rss_kb":10740,"binary_bytes":680128},{"wall_ms":3,"exit_code":0,"warmup":false,"timed_out":false,"cpu_ms":3,"page_faults":0,"ctx_switches":8,"max_rss_kb":10740,"binary_bytes":680128},{"wall_ms":3,"exit_code":0,"warmup":false,"timed_out":false,"cpu_ms":2,"page_faults":0,"ctx_switches":7,"max_rss_kb":10740,"binary_bytes":680128},{"wall_ms":3,"exit_code":0,"warmup":false,"timed_out":false,"cpu_ms":3,"page_faults":0,"ctx_switches":8,"max_rss_kb":10740,"binary_bytes":680128},{"wall_ms":3,"exit_code":0,"warmup":false,"timed_out":false,"cpu_ms":3,"page_faults":0,"ctx_switches":7,"max_rss_kb":10740,"binary_bytes":680128},{"wall_ms":3,"exit_code":0,"warmup":false,"timed_out":false,"cpu_ms":2,"page_faults":0,"ctx_switches":7,"max_rss_kb":10740,"binary_bytes":680128},{"wall_ms":3,"exit_code":0,"warmup":false,"timed_out":false,"cpu_ms":3,"page_faults":0,"ctx_switches":7,"max_rss_kb":10740,"binary_bytes":680128},{"wall_ms":3,"exit_code":0,"warmup":false,"timed_out":false,"cpu_ms":3,"page_faults":0,"ctx_switches":8,"max_rss_kb":10796,"binary_bytes":680128},{"wall_ms":3,"exit_code":0,"warmup":false,"timed_out":false,"cpu_ms":2,"page_faults":0,"ctx_switches":7,"max_rss_kb":10796,"binary_bytes":680128},{"wall_ms":3,"exit_code":0,"warmup":false,"timed_out":false,"cpu_ms":2,"page_faults":0,"ctx_switches":7,"max_rss_kb":10796,"binary_bytes":680128},{"wall_ms":3,"exit_code":0,"warmup":false,"timed_out":false,"cpu_ms":3,"page_faults":0,"ctx_switches":7,"max_rss_kb":10796,"binary_bytes":680128},{"wall_ms":3,"exit_code":0,"warmup":false,"timed_out":false,"cpu_ms":3,"page_faults":0,"ctx_switches":7,"max_rss_kb":10796,"binary_bytes":680128},{"wall_ms":3,"exit_code":0,"warmup":false,"timed_out":false,"cpu_ms":2,"page_faults":0,"ctx_switches":7,"max_rss_kb":10796,"binary_bytes":680128}],"stats":{"wall_ms":{"median":3,"min":3,"max":4,"mean":3.066666666666667,"stddev":0.2581988897471612},"cpu_ms":{"median":3,"min":2,"max":3,"mean":2.5333333333333328,"stddev":0.5163977794943222},"page_faults":{"median":0,"min":0,"max":0,"mean":0.0,"stddev":0.0},"ctx_switches":{"median":7,"min":7,"max":8,"mean":7.200000000000001,"stddev":0.4140393356054126},"max_rss_kb":{"median":10740,"min":10740,"max":10796,"mean":10762.4,"stddev":28.39718295887812},"binary_bytes":{"median":680128,"min":680128,"max":680128,"mean":680128.0,"stddev":0.0}}}