{"schema":"perfgate.run.v1","tool":{"name":"perfgate","version":"0.2.0"},"run":{"id":"baseline","started_at":"1970-01-01T00:00:00Z","ended_at":"1970-01-01T00:00:00Z","host":{"os":"windows","arch":"x86_64","cpu_count":32,"memory_bytes":272315080704}},"bench":{"name":"pst_extract","command":["cmd","/c","echo pst_extract"],"repeat":3,"warmup":1,"work_units":1000},"samples":[{"wall_ms":35,"exit_code":0,"warmup":true,"timed_out":false,"stdout":"pst_extract\r\n"},{"wall_ms":24,"exit_code":0,"warmup":false,"timed_out":false,"stdout":"pst_extract\r\n"},{"wall_ms":16,"exit_code":0,"warmup":false,"timed_out":false,"stdout":"pst_extract\r\n"},{"wall_ms":19,"exit_code":0,"warmup":false,"timed_out":false,"stdout":"pst_extract\r\n"}],"stats":{"wall_ms":{"median":19,"min":16,"max":24},"throughput_per_s":{"median":52631.57894736842,"min":41666.666666666664,"max":62500.0}}}