{"schema":"perfgate.run.v1","tool":{"name":"perfgate","version":"0.4.1"},"run":{"id":"5ce82d28-1d65-45fa-9248-dbb1dcca5ec9","started_at":"2026-03-16T22:44:54.3068465Z","ended_at":"2026-03-16T22:44:56.9225546Z","host":{"os":"windows","arch":"x86_64","cpu_count":32,"memory_bytes":272315080704}},"bench":{"name":"cli/compare-large","command":["bash",".ci/perf/compare-large.sh"],"repeat":7,"warmup":1},"samples":[{"wall_ms":214,"exit_code":2,"warmup":true,"timed_out":false,"cpu_ms":31,"page_faults":2110,"max_rss_kb":8220,"binary_bytes":86016,"stderr":".ci/perf/compare-large.sh: line 2: set: -\r: invalid option\nset: usage: set [-abefhkmnptuvxBCEHPT] [-o option-name] [--] [-] [arg ...]\n.ci/perf/compare-large.sh: line 8: syntax error: unexpected end of file\n"},{"wall_ms":223,"exit_code":2,"warmup":false,"timed_out":false,"cpu_ms":0,"page_faults":2111,"max_rss_kb":8216,"binary_bytes":86016,"stderr":".ci/perf/compare-large.sh: line 2: set: -\r: invalid option\nset: usage: set [-abefhkmnptuvxBCEHPT] [-o option-name] [--] [-] [arg ...]\n.ci/perf/compare-large.sh: line 8: syntax error: unexpected end of file\n"},{"wall_ms":251,"exit_code":2,"warmup":false,"timed_out":false,"cpu_ms":15,"page_faults":2114,"max_rss_kb":8232,"binary_bytes":86016,"stderr":".ci/perf/compare-large.sh: line 2: set: -\r: invalid option\nset: usage: set [-abefhkmnptuvxBCEHPT] [-o option-name] [--] [-] [arg ...]\n.ci/perf/compare-large.sh: line 8: syntax error: unexpected end of file\n"},{"wall_ms":284,"exit_code":2,"warmup":false,"timed_out":false,"cpu_ms":15,"page_faults":2107,"max_rss_kb":8204,"binary_bytes":86016,"stderr":".ci/perf/compare-large.sh: line 2: set: -\r: invalid option\nset: usage: set [-abefhkmnptuvxBCEHPT] [-o option-name] [--] [-] [arg ...]\n.ci/perf/compare-large.sh: line 8: syntax error: unexpected end of file\n"},{"wall_ms":359,"exit_code":2,"warmup":false,"timed_out":false,"cpu_ms":15,"page_faults":2104,"max_rss_kb":8192,"binary_bytes":86016,"stderr":".ci/perf/compare-large.sh: line 2: set: -\r: invalid option\nset: usage: set [-abefhkmnptuvxBCEHPT] [-o option-name] [--] [-] [arg ...]\n.ci/perf/compare-large.sh: line 8: syntax error: unexpected end of file\n"},{"wall_ms":433,"exit_code":2,"warmup":false,"timed_out":false,"cpu_ms":0,"page_faults":2114,"max_rss_kb":8220,"binary_bytes":86016,"stderr":".ci/perf/compare-large.sh: line 2: set: -\r: invalid option\nset: usage: set [-abefhkmnptuvxBCEHPT] [-o option-name] [--] [-] [arg ...]\n.ci/perf/compare-large.sh: line 8: syntax error: unexpected end of file\n"},{"wall_ms":332,"exit_code":2,"warmup":false,"timed_out":false,"cpu_ms":15,"page_faults":2113,"max_rss_kb":8220,"binary_bytes":86016,"stderr":".ci/perf/compare-large.sh: line 2: set: -\r: invalid option\nset: usage: set [-abefhkmnptuvxBCEHPT] [-o option-name] [--] [-] [arg ...]\n.ci/perf/compare-large.sh: line 8: syntax error: unexpected end of file\n"},{"wall_ms":468,"exit_code":2,"warmup":false,"timed_out":false,"cpu_ms":15,"page_faults":2113,"max_rss_kb":8220,"binary_bytes":86016,"stderr":".ci/perf/compare-large.sh: line 2: set: -\r: invalid option\nset: usage: set [-abefhkmnptuvxBCEHPT] [-o option-name] [--] [-] [arg ...]\n.ci/perf/compare-large.sh: line 8: syntax error: unexpected end of file\n"}],"stats":{"wall_ms":{"median":332,"min":223,"max":468},"cpu_ms":{"median":15,"min":0,"max":15},"page_faults":{"median":2113,"min":2104,"max":2114},"max_rss_kb":{"median":8220,"min":8192,"max":8232},"binary_bytes":{"median":86016,"min":86016,"max":86016}}}