{"schema":"perfgate.run.v1","tool":{"name":"perfgate","version":"0.4.1"},"run":{"id":"c48062fd-29a4-421e-ae40-3ac92799f6a0","started_at":"2026-03-16T22:44:50.9727507Z","ended_at":"2026-03-16T22:44:54.2811202Z","host":{"os":"windows","arch":"x86_64","cpu_count":32,"memory_bytes":272315080704}},"bench":{"name":"cli/compare-small","command":["bash",".ci/perf/compare-small.sh"],"repeat":7,"warmup":1},"samples":[{"wall_ms":589,"exit_code":2,"warmup":true,"timed_out":false,"cpu_ms":15,"page_faults":2113,"max_rss_kb":8220,"binary_bytes":86016,"stderr":".ci/perf/compare-small.sh: line 2: set: -\r: invalid option\nset: usage: set [-abefhkmnptuvxBCEHPT] [-o option-name] [--] [-] [arg ...]\n.ci/perf/compare-small.sh: line 8: syntax error: unexpected end of file\n"},{"wall_ms":401,"exit_code":2,"warmup":false,"timed_out":false,"cpu_ms":15,"page_faults":2111,"max_rss_kb":8220,"binary_bytes":86016,"stderr":".ci/perf/compare-small.sh: line 2: set: -\r: invalid option\nset: usage: set [-abefhkmnptuvxBCEHPT] [-o option-name] [--] [-] [arg ...]\n.ci/perf/compare-small.sh: line 8: syntax error: unexpected end of file\n"},{"wall_ms":360,"exit_code":2,"warmup":false,"timed_out":false,"cpu_ms":31,"page_faults":2113,"max_rss_kb":8216,"binary_bytes":86016,"stderr":".ci/perf/compare-small.sh: line 2: set: -\r: invalid option\nset: usage: set [-abefhkmnptuvxBCEHPT] [-o option-name] [--] [-] [arg ...]\n.ci/perf/compare-small.sh: line 8: syntax error: unexpected end of file\n"},{"wall_ms":662,"exit_code":2,"warmup":false,"timed_out":false,"cpu_ms":15,"page_faults":2115,"max_rss_kb":8228,"binary_bytes":86016,"stderr":".ci/perf/compare-small.sh: line 2: set: -\r: invalid option\nset: usage: set [-abefhkmnptuvxBCEHPT] [-o option-name] [--] [-] [arg ...]\n.ci/perf/compare-small.sh: line 8: syntax error: unexpected end of file\n"},{"wall_ms":121,"exit_code":2,"warmup":false,"timed_out":false,"cpu_ms":15,"page_faults":2115,"max_rss_kb":8228,"binary_bytes":86016,"stderr":".ci/perf/compare-small.sh: line 2: set: -\r: invalid option\nset: usage: set [-abefhkmnptuvxBCEHPT] [-o option-name] [--] [-] [arg ...]\n.ci/perf/compare-small.sh: line 8: syntax error: unexpected end of file\n"},{"wall_ms":150,"exit_code":2,"warmup":false,"timed_out":false,"cpu_ms":15,"page_faults":2114,"max_rss_kb":8224,"binary_bytes":86016,"stderr":".ci/perf/compare-small.sh: line 2: set: -\r: invalid option\nset: usage: set [-abefhkmnptuvxBCEHPT] [-o option-name] [--] [-] [arg ...]\n.ci/perf/compare-small.sh: line 8: syntax error: unexpected end of file\n"},{"wall_ms":306,"exit_code":2,"warmup":false,"timed_out":false,"cpu_ms":31,"page_faults":2113,"max_rss_kb":8220,"binary_bytes":86016,"stderr":".ci/perf/compare-small.sh: line 2: set: -\r: invalid option\nset: usage: set [-abefhkmnptuvxBCEHPT] [-o option-name] [--] [-] [arg ...]\n.ci/perf/compare-small.sh: line 8: syntax error: unexpected end of file\n"},{"wall_ms":677,"exit_code":2,"warmup":false,"timed_out":false,"cpu_ms":15,"page_faults":2110,"max_rss_kb":8204,"binary_bytes":86016,"stderr":".ci/perf/compare-small.sh: line 2: set: -\r: invalid option\nset: usage: set [-abefhkmnptuvxBCEHPT] [-o option-name] [--] [-] [arg ...]\n.ci/perf/compare-small.sh: line 8: syntax error: unexpected end of file\n"}],"stats":{"wall_ms":{"median":360,"min":121,"max":677},"cpu_ms":{"median":15,"min":15,"max":31},"page_faults":{"median":2113,"min":2110,"max":2115},"max_rss_kb":{"median":8220,"min":8204,"max":8228},"binary_bytes":{"median":86016,"min":86016,"max":86016}}}