{
    "schema": "perfgate.run.v1",
    "tool": {"name": "perfgate", "version": "0.1.0"},
    "run": {
        "id": "baseline",
        "started_at": "2024-01-01T00:00:00Z",
        "ended_at": "2024-01-01T00:01:00Z",
        "host": {"os": "linux", "arch": "x86_64"}
    },
    "bench": {
        "name": "cpu-budget-test",
        "command": ["echo", "hello"],
        "repeat": 2,
        "warmup": 0
    },
    "samples": [
        {"wall_ms": 100, "exit_code": 0, "warmup": false, "timed_out": false, "cpu_ms": 50},
        {"wall_ms": 100, "exit_code": 0, "warmup": false, "timed_out": false, "cpu_ms": 50}
    ],
    "stats": {
        "wall_ms": {"median": 100, "min": 100, "max": 100},
        "cpu_ms": {"median": 50, "min": 50, "max": 50}
    }
}
