{"schema":"perfgate.run.v1","tool":{"name":"perfgate","version":"0.4.1"},"run":{"id":"6630adba-1487-4108-a1a1-f1f4a87bf766","started_at":"2026-03-16T22:45:02.7888376Z","ended_at":"2026-03-16T22:45:04.0448425Z","host":{"os":"windows","arch":"x86_64","cpu_count":32,"memory_bytes":272315080704}},"bench":{"name":"render/md","command":["bash",".ci/perf/render-md.sh"],"repeat":7,"warmup":1},"samples":[{"wall_ms":221,"exit_code":2,"warmup":true,"timed_out":false,"cpu_ms":31,"page_faults":2108,"max_rss_kb":8212,"binary_bytes":86016,"stderr":".ci/perf/render-md.sh: line 2: set: -\r: invalid option\nset: usage: set [-abefhkmnptuvxBCEHPT] [-o option-name] [--] [-] [arg ...]\n.ci/perf/render-md.sh: line 8: syntax error: unexpected end of file\n"},{"wall_ms":190,"exit_code":2,"warmup":false,"timed_out":false,"cpu_ms":31,"page_faults":2114,"max_rss_kb":8228,"binary_bytes":86016,"stderr":".ci/perf/render-md.sh: line 2: set: -\r: invalid option\nset: usage: set [-abefhkmnptuvxBCEHPT] [-o option-name] [--] [-] [arg ...]\n.ci/perf/render-md.sh: line 8: syntax error: unexpected end of file\n"},{"wall_ms":220,"exit_code":2,"warmup":false,"timed_out":false,"cpu_ms":15,"page_faults":2116,"max_rss_kb":8224,"binary_bytes":86016,"stderr":".ci/perf/render-md.sh: line 2: set: -\r: invalid option\nset: usage: set [-abefhkmnptuvxBCEHPT] [-o option-name] [--] [-] [arg ...]\n.ci/perf/render-md.sh: line 8: syntax error: unexpected end of file\n"},{"wall_ms":134,"exit_code":2,"warmup":false,"timed_out":false,"cpu_ms":15,"page_faults":2111,"max_rss_kb":8216,"binary_bytes":86016,"stderr":".ci/perf/render-md.sh: line 2: set: -\r: invalid option\nset: usage: set [-abefhkmnptuvxBCEHPT] [-o option-name] [--] [-] [arg ...]\n.ci/perf/render-md.sh: line 8: syntax error: unexpected end of file\n"},{"wall_ms":118,"exit_code":2,"warmup":false,"timed_out":false,"cpu_ms":31,"page_faults":2113,"max_rss_kb":8224,"binary_bytes":86016,"stderr":".ci/perf/render-md.sh: line 2: set: -\r: invalid option\nset: usage: set [-abefhkmnptuvxBCEHPT] [-o option-name] [--] [-] [arg ...]\n.ci/perf/render-md.sh: line 8: syntax error: unexpected end of file\n"},{"wall_ms":126,"exit_code":2,"warmup":false,"timed_out":false,"cpu_ms":31,"page_faults":2112,"max_rss_kb":8220,"binary_bytes":86016,"stderr":".ci/perf/render-md.sh: line 2: set: -\r: invalid option\nset: usage: set [-abefhkmnptuvxBCEHPT] [-o option-name] [--] [-] [arg ...]\n.ci/perf/render-md.sh: line 8: syntax error: unexpected end of file\n"},{"wall_ms":110,"exit_code":2,"warmup":false,"timed_out":false,"cpu_ms":15,"page_faults":2116,"max_rss_kb":8224,"binary_bytes":86016,"stderr":".ci/perf/render-md.sh: line 2: set: -\r: invalid option\nset: usage: set [-abefhkmnptuvxBCEHPT] [-o option-name] [--] [-] [arg ...]\n.ci/perf/render-md.sh: line 8: syntax error: unexpected end of file\n"},{"wall_ms":128,"exit_code":2,"warmup":false,"timed_out":false,"cpu_ms":15,"page_faults":2109,"max_rss_kb":8216,"binary_bytes":86016,"stderr":".ci/perf/render-md.sh: line 2: set: -\r: invalid option\nset: usage: set [-abefhkmnptuvxBCEHPT] [-o option-name] [--] [-] [arg ...]\n.ci/perf/render-md.sh: line 8: syntax error: unexpected end of file\n"}],"stats":{"wall_ms":{"median":128,"min":110,"max":220},"cpu_ms":{"median":15,"min":15,"max":31},"page_faults":{"median":2113,"min":2109,"max":2116},"max_rss_kb":{"median":8224,"min":8216,"max":8228},"binary_bytes":{"median":86016,"min":86016,"max":86016}}}