{"schema":"perfgate.run.v1","tool":{"name":"perfgate","version":"0.5.0"},"run":{"id":"532ed652-0771-4297-ab8e-8683af651fc9","started_at":"2026-03-16T23:17:58.379452936Z","ended_at":"2026-03-16T23:17:58.477610218Z","host":{"os":"linux","arch":"x86_64","cpu_count":4,"memory_bytes":16771563520}},"bench":{"name":"cli/check-no-baseline","command":["bash",".ci/perf/check-no-baseline.sh"],"repeat":7,"warmup":1},"samples":[{"wall_ms":12,"exit_code":0,"warmup":true,"timed_out":false,"cpu_ms":11,"page_faults":0,"ctx_switches":38,"max_rss_kb":6788,"binary_bytes":1446024,"stderr":"warning: markdown template ignored for no-baseline bench\nwarning: no baseline found for bench 'test-no-baseline', skipping comparison\n"},{"wall_ms":11,"exit_code":0,"warmup":false,"timed_out":false,"cpu_ms":11,"page_faults":0,"ctx_switches":34,"max_rss_kb":6788,"binary_bytes":1446024,"stderr":"warning: markdown template ignored for no-baseline bench\nwarning: no baseline found for bench 'test-no-baseline', skipping comparison\n"},{"wall_ms":11,"exit_code":0,"warmup":false,"timed_out":false,"cpu_ms":10,"page_faults":0,"ctx_switches":34,"max_rss_kb":6788,"binary_bytes":1446024,"stderr":"warning: markdown template ignored for no-baseline bench\nwarning: no baseline found for bench 'test-no-baseline', skipping comparison\n"},{"wall_ms":12,"exit_code":0,"warmup":false,"timed_out":false,"cpu_ms":11,"page_faults":0,"ctx_switches":34,"max_rss_kb":6788,"binary_bytes":1446024,"stderr":"warning: markdown template ignored for no-baseline bench\nwarning: no baseline found for bench 'test-no-baseline', skipping comparison\n"},{"wall_ms":12,"exit_code":0,"warmup":false,"timed_out":false,"cpu_ms":11,"page_faults":0,"ctx_switches":38,"max_rss_kb":6788,"binary_bytes":1446024,"stderr":"warning: markdown template ignored for no-baseline bench\nwarning: no baseline found for bench 'test-no-baseline', skipping comparison\n"},{"wall_ms":12,"exit_code":0,"warmup":false,"timed_out":false,"cpu_ms":10,"page_faults":0,"ctx_switches":36,"max_rss_kb":6788,"binary_bytes":1446024,"stderr":"warning: markdown template ignored for no-baseline bench\nwarning: no baseline found for bench 'test-no-baseline', skipping comparison\n"},{"wall_ms":12,"exit_code":0,"warmup":false,"timed_out":false,"cpu_ms":11,"page_faults":0,"ctx_switches":33,"max_rss_kb":6788,"binary_bytes":1446024,"stderr":"warning: markdown template ignored for no-baseline bench\nwarning: no baseline found for bench 'test-no-baseline', skipping comparison\n"},{"wall_ms":12,"exit_code":0,"warmup":false,"timed_out":false,"cpu_ms":11,"page_faults":0,"ctx_switches":37,"max_rss_kb":6788,"binary_bytes":1446024,"stderr":"warning: markdown template ignored for no-baseline bench\nwarning: no baseline found for bench 'test-no-baseline', skipping comparison\n"}],"stats":{"wall_ms":{"median":12,"min":11,"max":12},"cpu_ms":{"median":11,"min":10,"max":11},"page_faults":{"median":0,"min":0,"max":0},"ctx_switches":{"median":34,"min":33,"max":38},"max_rss_kb":{"median":6788,"min":6788,"max":6788},"binary_bytes":{"median":1446024,"min":1446024,"max":1446024}}}