{"schema":"perfgate.run.v1","tool":{"name":"perfgate","version":"0.4.1"},"run":{"id":"c434efc1-476f-4e5c-8e10-f224dc6f9a15","started_at":"2026-03-16T22:42:02.0927489Z","ended_at":"2026-03-16T22:42:02.3115737Z","host":{"os":"windows","arch":"x86_64","cpu_count":32,"memory_bytes":272315080704}},"bench":{"name":"test-bench","command":["git","--version"],"repeat":5,"warmup":1},"samples":[{"wall_ms":38,"exit_code":0,"warmup":true,"timed_out":false,"cpu_ms":15,"page_faults":2308,"max_rss_kb":8844,"binary_bytes":46464,"stdout":"git version 2.53.0.windows.2\n"},{"wall_ms":42,"exit_code":0,"warmup":false,"timed_out":false,"cpu_ms":15,"page_faults":2282,"max_rss_kb":8844,"binary_bytes":46464,"stdout":"git version 2.53.0.windows.2\n"},{"wall_ms":30,"exit_code":0,"warmup":false,"timed_out":false,"cpu_ms":0,"page_faults":2282,"max_rss_kb":8844,"binary_bytes":46464,"stdout":"git version 2.53.0.windows.2\n"},{"wall_ms":43,"exit_code":0,"warmup":false,"timed_out":false,"cpu_ms":0,"page_faults":2281,"max_rss_kb":8844,"binary_bytes":46464,"stdout":"git version 2.53.0.windows.2\n"},{"wall_ms":33,"exit_code":0,"warmup":false,"timed_out":false,"cpu_ms":0,"page_faults":2282,"max_rss_kb":8848,"binary_bytes":46464,"stdout":"git version 2.53.0.windows.2\n"},{"wall_ms":29,"exit_code":0,"warmup":false,"timed_out":false,"cpu_ms":0,"page_faults":2281,"max_rss_kb":8840,"binary_bytes":46464,"stdout":"git version 2.53.0.windows.2\n"}],"stats":{"wall_ms":{"median":33,"min":29,"max":43},"cpu_ms":{"median":0,"min":0,"max":15},"page_faults":{"median":2282,"min":2281,"max":2282},"max_rss_kb":{"median":8844,"min":8840,"max":8848},"binary_bytes":{"median":46464,"min":46464,"max":46464}}}