{"schema":"perfgate.run.v1","tool":{"name":"perfgate","version":"0.4.1"},"run":{"id":"684496e9-fcc2-42a5-bea7-2211ea948dea","started_at":"2026-03-16T22:44:56.9548528Z","ended_at":"2026-03-16T22:44:59.8741233Z","host":{"os":"windows","arch":"x86_64","cpu_count":32,"memory_bytes":272315080704}},"bench":{"name":"cli/check-single","command":["bash",".ci/perf/check-single.sh"],"repeat":7,"warmup":1},"samples":[{"wall_ms":297,"exit_code":2,"warmup":true,"timed_out":false,"cpu_ms":15,"page_faults":2110,"max_rss_kb":8212,"binary_bytes":86016,"stderr":".ci/perf/check-single.sh: line 2: set: -\r: invalid option\nset: usage: set [-abefhkmnptuvxBCEHPT] [-o option-name] [--] [-] [arg ...]\n.ci/perf/check-single.sh: line 8: syntax error: unexpected end of file\n"},{"wall_ms":276,"exit_code":2,"warmup":false,"timed_out":false,"cpu_ms":15,"page_faults":2113,"max_rss_kb":8220,"binary_bytes":86016,"stderr":".ci/perf/check-single.sh: line 2: set: -\r: invalid option\nset: usage: set [-abefhkmnptuvxBCEHPT] [-o option-name] [--] [-] [arg ...]\n.ci/perf/check-single.sh: line 8: syntax error: unexpected end of file\n"},{"wall_ms":300,"exit_code":2,"warmup":false,"timed_out":false,"cpu_ms":0,"page_faults":2115,"max_rss_kb":8232,"binary_bytes":86016,"stderr":".ci/perf/check-single.sh: line 2: set: -\r: invalid option\nset: usage: set [-abefhkmnptuvxBCEHPT] [-o option-name] [--] [-] [arg ...]\n.ci/perf/check-single.sh: line 8: syntax error: unexpected end of file\n"},{"wall_ms":251,"exit_code":2,"warmup":false,"timed_out":false,"cpu_ms":31,"page_faults":2110,"max_rss_kb":8216,"binary_bytes":86016,"stderr":".ci/perf/check-single.sh: line 2: set: -\r: invalid option\nset: usage: set [-abefhkmnptuvxBCEHPT] [-o option-name] [--] [-] [arg ...]\n.ci/perf/check-single.sh: line 8: syntax error: unexpected end of file\n"},{"wall_ms":336,"exit_code":2,"warmup":false,"timed_out":false,"cpu_ms":15,"page_faults":2107,"max_rss_kb":8200,"binary_bytes":86016,"stderr":".ci/perf/check-single.sh: line 2: set: -\r: invalid option\nset: usage: set [-abefhkmnptuvxBCEHPT] [-o option-name] [--] [-] [arg ...]\n.ci/perf/check-single.sh: line 8: syntax error: unexpected end of file\n"},{"wall_ms":546,"exit_code":2,"warmup":false,"timed_out":false,"cpu_ms":0,"page_faults":2108,"max_rss_kb":8212,"binary_bytes":86016,"stderr":".ci/perf/check-single.sh: line 2: set: -\r: invalid option\nset: usage: set [-abefhkmnptuvxBCEHPT] [-o option-name] [--] [-] [arg ...]\n.ci/perf/check-single.sh: line 8: syntax error: unexpected end of file\n"},{"wall_ms":461,"exit_code":2,"warmup":false,"timed_out":false,"cpu_ms":15,"page_faults":2109,"max_rss_kb":8204,"binary_bytes":86016,"stderr":".ci/perf/check-single.sh: line 2: set: -\r: invalid option\nset: usage: set [-abefhkmnptuvxBCEHPT] [-o option-name] [--] [-] [arg ...]\n.ci/perf/check-single.sh: line 8: syntax error: unexpected end of file\n"},{"wall_ms":443,"exit_code":2,"warmup":false,"timed_out":false,"cpu_ms":0,"page_faults":2113,"max_rss_kb":8220,"binary_bytes":86016,"stderr":".ci/perf/check-single.sh: line 2: set: -\r: invalid option\nset: usage: set [-abefhkmnptuvxBCEHPT] [-o option-name] [--] [-] [arg ...]\n.ci/perf/check-single.sh: line 8: syntax error: unexpected end of file\n"}],"stats":{"wall_ms":{"median":336,"min":251,"max":546},"cpu_ms":{"median":15,"min":0,"max":31},"page_faults":{"median":2110,"min":2107,"max":2115},"max_rss_kb":{"median":8216,"min":8200,"max":8232},"binary_bytes":{"median":86016,"min":86016,"max":86016}}}