{"schema":"perfgate.run.v1","tool":{"name":"perfgate","version":"0.5.0"},"run":{"id":"d78ba7b4-4d87-4345-a513-8cb1ef091729","started_at":"2026-03-16T23:17:58.289378908Z","ended_at":"2026-03-16T23:17:58.37610719Z","host":{"os":"linux","arch":"x86_64","cpu_count":4,"memory_bytes":16771563520}},"bench":{"name":"cli/check-single","command":["bash",".ci/perf/check-single.sh"],"repeat":7,"warmup":1},"samples":[{"wall_ms":10,"exit_code":0,"warmup":true,"timed_out":false,"cpu_ms":11,"page_faults":0,"ctx_switches":31,"max_rss_kb":6788,"binary_bytes":1446024,"stderr":"baseline value for CpuMs must be > 0\n"},{"wall_ms":10,"exit_code":0,"warmup":false,"timed_out":false,"cpu_ms":10,"page_faults":0,"ctx_switches":31,"max_rss_kb":6820,"binary_bytes":1446024,"stderr":"baseline value for CpuMs must be > 0\n"},{"wall_ms":10,"exit_code":0,"warmup":false,"timed_out":false,"cpu_ms":11,"page_faults":0,"ctx_switches":34,"max_rss_kb":6888,"binary_bytes":1446024,"stderr":"baseline value for CpuMs must be > 0\n"},{"wall_ms":10,"exit_code":0,"warmup":false,"timed_out":false,"cpu_ms":10,"page_faults":0,"ctx_switches":29,"max_rss_kb":6788,"binary_bytes":1446024,"stderr":"baseline value for CpuMs must be > 0\n"},{"wall_ms":11,"exit_code":0,"warmup":false,"timed_out":false,"cpu_ms":11,"page_faults":0,"ctx_switches":29,"max_rss_kb":6788,"binary_bytes":1446024,"stderr":"baseline value for CpuMs must be > 0\n"},{"wall_ms":11,"exit_code":0,"warmup":false,"timed_out":false,"cpu_ms":11,"page_faults":0,"ctx_switches":34,"max_rss_kb":6788,"binary_bytes":1446024,"stderr":"baseline value for CpuMs must be > 0\n"},{"wall_ms":10,"exit_code":0,"warmup":false,"timed_out":false,"cpu_ms":11,"page_faults":0,"ctx_switches":34,"max_rss_kb":6788,"binary_bytes":1446024,"stderr":"baseline value for CpuMs must be > 0\n"},{"wall_ms":11,"exit_code":0,"warmup":false,"timed_out":false,"cpu_ms":11,"page_faults":0,"ctx_switches":35,"max_rss_kb":6788,"binary_bytes":1446024,"stderr":"baseline value for CpuMs must be > 0\n"}],"stats":{"wall_ms":{"median":10,"min":10,"max":11},"cpu_ms":{"median":11,"min":10,"max":11},"page_faults":{"median":0,"min":0,"max":0},"ctx_switches":{"median":34,"min":29,"max":35},"max_rss_kb":{"median":6788,"min":6788,"max":6888},"binary_bytes":{"median":1446024,"min":1446024,"max":1446024}}}