{"schema":"perfgate.run.v1","tool":{"name":"perfgate","version":"0.5.0"},"run":{"id":"e5a80b48-8976-43ea-845b-2422c346c971","started_at":"2026-03-16T23:17:58.223893263Z","ended_at":"2026-03-16T23:17:58.285922215Z","host":{"os":"linux","arch":"x86_64","cpu_count":4,"memory_bytes":16771563520}},"bench":{"name":"cli/compare-large","command":["bash",".ci/perf/compare-large.sh"],"repeat":7,"warmup":1},"samples":[{"wall_ms":8,"exit_code":0,"warmup":true,"timed_out":false,"cpu_ms":6,"page_faults":0,"ctx_switches":10,"max_rss_kb":6788,"binary_bytes":1446024},{"wall_ms":7,"exit_code":0,"warmup":false,"timed_out":false,"cpu_ms":6,"page_faults":0,"ctx_switches":12,"max_rss_kb":6788,"binary_bytes":1446024},{"wall_ms":7,"exit_code":0,"warmup":false,"timed_out":false,"cpu_ms":6,"page_faults":0,"ctx_switches":10,"max_rss_kb":6788,"binary_bytes":1446024},{"wall_ms":7,"exit_code":0,"warmup":false,"timed_out":false,"cpu_ms":6,"page_faults":0,"ctx_switches":10,"max_rss_kb":6788,"binary_bytes":1446024},{"wall_ms":7,"exit_code":0,"warmup":false,"timed_out":false,"cpu_ms":7,"page_faults":0,"ctx_switches":12,"max_rss_kb":6788,"binary_bytes":1446024},{"wall_ms":7,"exit_code":0,"warmup":false,"timed_out":false,"cpu_ms":6,"page_faults":0,"ctx_switches":12,"max_rss_kb":6788,"binary_bytes":1446024},{"wall_ms":7,"exit_code":0,"warmup":false,"timed_out":false,"cpu_ms":6,"page_faults":0,"ctx_switches":11,"max_rss_kb":6788,"binary_bytes":1446024},{"wall_ms":7,"exit_code":0,"warmup":false,"timed_out":false,"cpu_ms":7,"page_faults":0,"ctx_switches":10,"max_rss_kb":6788,"binary_bytes":1446024}],"stats":{"wall_ms":{"median":7,"min":7,"max":7},"cpu_ms":{"median":6,"min":6,"max":7},"page_faults":{"median":0,"min":0,"max":0},"ctx_switches":{"median":11,"min":10,"max":12},"max_rss_kb":{"median":6788,"min":6788,"max":6788},"binary_bytes":{"median":1446024,"min":1446024,"max":1446024}}}