{"schema":"perfgate.run.v1","tool":{"name":"perfgate","version":"0.4.1"},"run":{"id":"89e77e60-798d-408e-a411-e761e60a5d41","started_at":"2026-03-16T22:45:04.0592125Z","ended_at":"2026-03-16T22:45:05.1391282Z","host":{"os":"windows","arch":"x86_64","cpu_count":32,"memory_bytes":272315080704}},"bench":{"name":"render/report","command":["bash",".ci/perf/render-report.sh"],"repeat":7,"warmup":1},"samples":[{"wall_ms":150,"exit_code":2,"warmup":true,"timed_out":false,"cpu_ms":0,"page_faults":2108,"max_rss_kb":8216,"binary_bytes":86016,"stderr":".ci/perf/render-report.sh: line 2: set: -\r: invalid option\nset: usage: set [-abefhkmnptuvxBCEHPT] [-o option-name] [--] [-] [arg ...]\n.ci/perf/render-report.sh: line 8: syntax error: unexpected end of file\n"},{"wall_ms":141,"exit_code":2,"warmup":false,"timed_out":false,"cpu_ms":15,"page_faults":2113,"max_rss_kb":8220,"binary_bytes":86016,"stderr":".ci/perf/render-report.sh: line 2: set: -\r: invalid option\nset: usage: set [-abefhkmnptuvxBCEHPT] [-o option-name] [--] [-] [arg ...]\n.ci/perf/render-report.sh: line 8: syntax error: unexpected end of file\n"},{"wall_ms":117,"exit_code":2,"warmup":false,"timed_out":false,"cpu_ms":15,"page_faults":2114,"max_rss_kb":8236,"binary_bytes":86016,"stderr":".ci/perf/render-report.sh: line 2: set: -\r: invalid option\nset: usage: set [-abefhkmnptuvxBCEHPT] [-o option-name] [--] [-] [arg ...]\n.ci/perf/render-report.sh: line 8: syntax error: unexpected end of file\n"},{"wall_ms":140,"exit_code":2,"warmup":false,"timed_out":false,"cpu_ms":0,"page_faults":2113,"max_rss_kb":8224,"binary_bytes":86016,"stderr":".ci/perf/render-report.sh: line 2: set: -\r: invalid option\nset: usage: set [-abefhkmnptuvxBCEHPT] [-o option-name] [--] [-] [arg ...]\n.ci/perf/render-report.sh: line 8: syntax error: unexpected end of file\n"},{"wall_ms":122,"exit_code":2,"warmup":false,"timed_out":false,"cpu_ms":15,"page_faults":2112,"max_rss_kb":8220,"binary_bytes":86016,"stderr":".ci/perf/render-report.sh: line 2: set: -\r: invalid option\nset: usage: set [-abefhkmnptuvxBCEHPT] [-o option-name] [--] [-] [arg ...]\n.ci/perf/render-report.sh: line 8: syntax error: unexpected end of file\n"},{"wall_ms":131,"exit_code":2,"warmup":false,"timed_out":false,"cpu_ms":0,"page_faults":2114,"max_rss_kb":8220,"binary_bytes":86016,"stderr":".ci/perf/render-report.sh: line 2: set: -\r: invalid option\nset: usage: set [-abefhkmnptuvxBCEHPT] [-o option-name] [--] [-] [arg ...]\n.ci/perf/render-report.sh: line 8: syntax error: unexpected end of file\n"},{"wall_ms":162,"exit_code":2,"warmup":false,"timed_out":false,"cpu_ms":15,"page_faults":2112,"max_rss_kb":8220,"binary_bytes":86016,"stderr":".ci/perf/render-report.sh: line 2: set: -\r: invalid option\nset: usage: set [-abefhkmnptuvxBCEHPT] [-o option-name] [--] [-] [arg ...]\n.ci/perf/render-report.sh: line 8: syntax error: unexpected end of file\n"},{"wall_ms":112,"exit_code":2,"warmup":false,"timed_out":false,"cpu_ms":15,"page_faults":2113,"max_rss_kb":8220,"binary_bytes":86016,"stderr":".ci/perf/render-report.sh: line 2: set: -\r: invalid option\nset: usage: set [-abefhkmnptuvxBCEHPT] [-o option-name] [--] [-] [arg ...]\n.ci/perf/render-report.sh: line 8: syntax error: unexpected end of file\n"}],"stats":{"wall_ms":{"median":131,"min":112,"max":162},"cpu_ms":{"median":15,"min":0,"max":15},"page_faults":{"median":2113,"min":2112,"max":2114},"max_rss_kb":{"median":8220,"min":8220,"max":8236},"binary_bytes":{"median":86016,"min":86016,"max":86016}}}