{"schema":"perfgate.run.v1","tool":{"name":"perfgate","version":"0.5.0"},"run":{"id":"798233b8-7ea4-45db-8193-d800d9c14b65","started_at":"2026-03-16T23:17:58.481594375Z","ended_at":"2026-03-16T23:17:58.533031299Z","host":{"os":"linux","arch":"x86_64","cpu_count":4,"memory_bytes":16771563520}},"bench":{"name":"render/md","command":["bash",".ci/perf/render-md.sh"],"repeat":7,"warmup":1},"samples":[{"wall_ms":6,"exit_code":0,"warmup":true,"timed_out":false,"cpu_ms":6,"page_faults":0,"ctx_switches":9,"max_rss_kb":6788,"binary_bytes":1446024},{"wall_ms":6,"exit_code":0,"warmup":false,"timed_out":false,"cpu_ms":5,"page_faults":0,"ctx_switches":9,"max_rss_kb":6788,"binary_bytes":1446024},{"wall_ms":6,"exit_code":0,"warmup":false,"timed_out":false,"cpu_ms":6,"page_faults":0,"ctx_switches":9,"max_rss_kb":6788,"binary_bytes":1446024},{"wall_ms":6,"exit_code":0,"warmup":false,"timed_out":false,"cpu_ms":6,"page_faults":0,"ctx_switches":8,"max_rss_kb":6788,"binary_bytes":1446024},{"wall_ms":6,"exit_code":0,"warmup":false,"timed_out":false,"cpu_ms":6,"page_faults":0,"ctx_switches":8,"max_rss_kb":6788,"binary_bytes":1446024},{"wall_ms":6,"exit_code":0,"warmup":false,"timed_out":false,"cpu_ms":6,"page_faults":0,"ctx_switches":9,"max_rss_kb":6788,"binary_bytes":1446024},{"wall_ms":6,"exit_code":0,"warmup":false,"timed_out":false,"cpu_ms":6,"page_faults":0,"ctx_switches":8,"max_rss_kb":6788,"binary_bytes":1446024},{"wall_ms":6,"exit_code":0,"warmup":false,"timed_out":false,"cpu_ms":6,"page_faults":0,"ctx_switches":9,"max_rss_kb":6788,"binary_bytes":1446024}],"stats":{"wall_ms":{"median":6,"min":6,"max":6},"cpu_ms":{"median":6,"min":5,"max":6},"page_faults":{"median":0,"min":0,"max":0},"ctx_switches":{"median":9,"min":8,"max":9},"max_rss_kb":{"median":6788,"min":6788,"max":6788},"binary_bytes":{"median":1446024,"min":1446024,"max":1446024}}}