{"schema":"perfgate.run.v1","tool":{"name":"perfgate","version":"0.2.0"},"run":{"id":"baseline","started_at":"1970-01-01T00:00:00Z","ended_at":"1970-01-01T00:00:00Z","host":{"os":"windows","arch":"x86_64","cpu_count":32,"memory_bytes":272315080704}},"bench":{"name":"pst_load","command":["cmd","/c","echo pst_load"],"repeat":3,"warmup":1},"samples":[{"wall_ms":49,"exit_code":0,"warmup":true,"timed_out":false,"stdout":"pst_load\r\n"},{"wall_ms":180,"exit_code":0,"warmup":false,"timed_out":false,"stdout":"pst_load\r\n"},{"wall_ms":14,"exit_code":0,"warmup":false,"timed_out":false,"stdout":"pst_load\r\n"},{"wall_ms":37,"exit_code":0,"warmup":false,"timed_out":false,"stdout":"pst_load\r\n"}],"stats":{"wall_ms":{"median":37,"min":14,"max":180}}}