{"schema":"perfgate.run.v1","tool":{"name":"perfgate","version":"0.5.0"},"run":{"id":"4bb18107-e159-43de-99f5-88be4cb6bbac","started_at":"2026-03-17T04:33:18.3442511Z","ended_at":"2026-03-17T04:33:18.4649194Z","host":{"os":"windows","arch":"x86_64","cpu_count":32,"memory_bytes":272315080704}},"bench":{"name":"test-bench","command":["./target/release/perfgate-selfbench.exe","noop"],"repeat":5,"warmup":1},"samples":[{"wall_ms":21,"exit_code":0,"warmup":true,"timed_out":false,"cpu_ms":15,"page_faults":1074,"max_rss_kb":4116,"binary_bytes":238080},{"wall_ms":17,"exit_code":0,"warmup":false,"timed_out":false,"cpu_ms":15,"page_faults":1079,"max_rss_kb":4128,"binary_bytes":238080},{"wall_ms":10,"exit_code":0,"warmup":false,"timed_out":false,"cpu_ms":15,"page_faults":1075,"max_rss_kb":4124,"binary_bytes":238080},{"wall_ms":23,"exit_code":0,"warmup":false,"timed_out":false,"cpu_ms":15,"page_faults":1080,"max_rss_kb":4132,"binary_bytes":238080},{"wall_ms":22,"exit_code":0,"warmup":false,"timed_out":false,"cpu_ms":31,"page_faults":1073,"max_rss_kb":4112,"binary_bytes":238080},{"wall_ms":20,"exit_code":0,"warmup":false,"timed_out":false,"cpu_ms":15,"page_faults":1078,"max_rss_kb":4132,"binary_bytes":238080}],"stats":{"wall_ms":{"median":20,"min":10,"max":23},"cpu_ms":{"median":15,"min":15,"max":31},"page_faults":{"median":1078,"min":1073,"max":1080},"max_rss_kb":{"median":4128,"min":4112,"max":4132},"binary_bytes":{"median":238080,"min":238080,"max":238080}}}