{"schema":"perfgate.run.v1","tool":{"name":"perfgate","version":"0.4.1"},"run":{"id":"81893eac-5c59-42e0-9ad3-9b0674717a2d","started_at":"2026-03-16T22:44:59.8972331Z","ended_at":"2026-03-16T22:45:02.7695509Z","host":{"os":"windows","arch":"x86_64","cpu_count":32,"memory_bytes":272315080704}},"bench":{"name":"cli/check-no-baseline","command":["bash",".ci/perf/check-no-baseline.sh"],"repeat":7,"warmup":1},"samples":[{"wall_ms":223,"exit_code":2,"warmup":true,"timed_out":false,"cpu_ms":15,"page_faults":2115,"max_rss_kb":8224,"binary_bytes":86016,"stderr":".ci/perf/check-no-baseline.sh: line 2: set: -\r: invalid option\nset: usage: set [-abefhkmnptuvxBCEHPT] [-o option-name] [--] [-] [arg ...]\n.ci/perf/check-no-baseline.sh: line 8: syntax error: unexpected end of file\n"},{"wall_ms":275,"exit_code":2,"warmup":false,"timed_out":false,"cpu_ms":15,"page_faults":2116,"max_rss_kb":8232,"binary_bytes":86016,"stderr":".ci/perf/check-no-baseline.sh: line 2: set: -\r: invalid option\nset: usage: set [-abefhkmnptuvxBCEHPT] [-o option-name] [--] [-] [arg ...]\n.ci/perf/check-no-baseline.sh: line 8: syntax error: unexpected end of file\n"},{"wall_ms":702,"exit_code":2,"warmup":false,"timed_out":false,"cpu_ms":15,"page_faults":2115,"max_rss_kb":8228,"binary_bytes":86016,"stderr":".ci/perf/check-no-baseline.sh: line 2: set: -\r: invalid option\nset: usage: set [-abefhkmnptuvxBCEHPT] [-o option-name] [--] [-] [arg ...]\n.ci/perf/check-no-baseline.sh: line 8: syntax error: unexpected end of file\n"},{"wall_ms":730,"exit_code":2,"warmup":false,"timed_out":false,"cpu_ms":15,"page_faults":2108,"max_rss_kb":8204,"binary_bytes":86016,"stderr":".ci/perf/check-no-baseline.sh: line 2: set: -\r: invalid option\nset: usage: set [-abefhkmnptuvxBCEHPT] [-o option-name] [--] [-] [arg ...]\n.ci/perf/check-no-baseline.sh: line 8: syntax error: unexpected end of file\n"},{"wall_ms":301,"exit_code":2,"warmup":false,"timed_out":false,"cpu_ms":46,"page_faults":2115,"max_rss_kb":8224,"binary_bytes":86016,"stderr":".ci/perf/check-no-baseline.sh: line 2: set: -\r: invalid option\nset: usage: set [-abefhkmnptuvxBCEHPT] [-o option-name] [--] [-] [arg ...]\n.ci/perf/check-no-baseline.sh: line 8: syntax error: unexpected end of file\n"},{"wall_ms":247,"exit_code":2,"warmup":false,"timed_out":false,"cpu_ms":46,"page_faults":2116,"max_rss_kb":8232,"binary_bytes":86016,"stderr":".ci/perf/check-no-baseline.sh: line 2: set: -\r: invalid option\nset: usage: set [-abefhkmnptuvxBCEHPT] [-o option-name] [--] [-] [arg ...]\n.ci/perf/check-no-baseline.sh: line 8: syntax error: unexpected end of file\n"},{"wall_ms":203,"exit_code":2,"warmup":false,"timed_out":false,"cpu_ms":31,"page_faults":2114,"max_rss_kb":8220,"binary_bytes":86016,"stderr":".ci/perf/check-no-baseline.sh: line 2: set: -\r: invalid option\nset: usage: set [-abefhkmnptuvxBCEHPT] [-o option-name] [--] [-] [arg ...]\n.ci/perf/check-no-baseline.sh: line 8: syntax error: unexpected end of file\n"},{"wall_ms":186,"exit_code":2,"warmup":false,"timed_out":false,"cpu_ms":46,"page_faults":2109,"max_rss_kb":8216,"binary_bytes":86016,"stderr":".ci/perf/check-no-baseline.sh: line 2: set: -\r: invalid option\nset: usage: set [-abefhkmnptuvxBCEHPT] [-o option-name] [--] [-] [arg ...]\n.ci/perf/check-no-baseline.sh: line 8: syntax error: unexpected end of file\n"}],"stats":{"wall_ms":{"median":275,"min":186,"max":730},"cpu_ms":{"median":31,"min":15,"max":46},"page_faults":{"median":2115,"min":2108,"max":2116},"max_rss_kb":{"median":8224,"min":8204,"max":8232},"binary_bytes":{"median":86016,"min":86016,"max":86016}}}